Date,Headline
2022-01-01,U.S. on Sidelines as China and Other Nations Launch Trade Pact
2022-01-01,10 Fitness Hacks for New Year’s Resolution Success
2022-01-01,Catholic Dioceses Investigate Their Role in Boarding Schools for Native Americans
2022-01-01,Red-Hot Housing Market Fuels Mortgage Borrowing Record
2022-01-01,New Covid-19 Pills Carry Risks: What Patients Should Know
2022-01-01,"U.S. Companies Are Thriving Despite, or Because of, Covid-19"
2022-01-01,"Kim Jong Un Largely Ignores U.S., South Korea in Year-End Speech"
2022-01-01,Electric Motors Are About to Get a Major Upgrade Thanks to Benjamin Franklin
2022-01-01,How College Students Beat Boeing in a Battle to Take Down Drones
2022-01-01,A Tattooed Union Leader Is Threatening to Topple a GOP Senator in a Deep-Red State
2022-01-01,Does Everything in Your Blue Bin Really Get Recycled? You’d Be Surprised
2022-01-01,The Racial Identity of Americans Is Rapidly Blurring. Politics Hasn’t Caught Up.
2022-01-01,Israel Releases Video Said to Show Final Moments of Hamas Leader Sinwar03:25
2022-01-01,Israel Releases Video Said to Show Final Moments of Hamas Leader Sinwar
2022-01-01,WSJ Opinion: Trump Calls Out Harris for Skipping Al Smith Dinner03:36
2022-01-01,WSJ Opinion: Trump Calls Out Harris for Skipping Al Smith Dinner
2022-01-01,Watch: Trump’s Microphone Cuts Out Mid-Speech in Detroit01:38
2022-01-01,Watch: Trump’s Microphone Cuts Out Mid-Speech in Detroit
2022-01-01,"WSJ Poll Shows Tied Battle for Swing States, Trump Leads on Top Issues02:44"
2022-01-01,"WSJ Poll Shows Tied Battle for Swing States, Trump Leads on Top Issues"
2022-01-01,Netanyahu: ‘Hamas Will No Longer Rule Gaza’ After Yahya Sinwar’s Death02:16
2022-01-01,Netanyahu: ‘Hamas Will No Longer Rule Gaza’ After Yahya Sinwar’s Death
2022-01-01,Corporate Subscriptions
2022-01-01,WSJ Higher Education Program
2022-01-01,WSJ High School Program
2022-01-01,Public Library Program
2022-01-01,Commercial Partnerships
2022-01-01,Cancel My Subscription
2022-01-01,Commercial Real Estate Ads
2022-01-01,Place a Classified Ad
2022-01-01,Recruitment & Career Ads
2022-01-01,Dow Jones Smart Money
2022-01-02,2022’s Biggest Challenges Come From Russia and Iran
2022-01-02,‘The Week’ Review: The Magic Number Seven
2022-01-02,No Justice for Cuba’s July 11 Protesters
2022-01-02,Millennials Are the Silencing Generation
2022-01-02,"It’s China vs. Walmart, Latest Western Brand Entangled in Human Rights Dispute"
2022-01-02,Chairman’s Resignation Hands Control of FDIC to Democrats
2022-01-02,"Economy Week Ahead: Eurozone Manufacturing, U.S. Jobs Report"
2022-01-02,Fire Inflicts Heavy Damage to South Africa’s Parliament Building
2022-01-02,"Jan. 6 Committee Plans Public Hearings, Possible Subpoenas Over Capitol Attack"
2022-01-02,A Booming Startup Market Prompts an Investment Rush
2022-01-02,How Generous Is Columbia University Really?
2022-01-02,Negotiating the U.S.-Japan Chip Pact of ’86
2022-01-02,Drug Prices Are High and Low
2022-01-02,Noonan and What Film Audiences Want
2022-01-02,Twitter Permanently Suspends One of Marjorie Taylor Greene’s Accounts
2022-01-02,China and Russia Military Cooperation Raises Prospect of New Challenge to American Power
2022-01-02,Tesla Reports 87% Growth in Annual Vehicle Deliveries
2022-01-02,Can Social Media Alter a War?
2022-01-02,"Betty White, a Humble Superstar"
2022-01-02,"U.S., Europe Weigh Isolation Requirements as Omicron Disrupts Daily Life"
2022-01-02,"Omicron Takes a Toll on Businesses, From Airports to Supermarkets"
2022-01-02,"Winter Storms, Covid-19 Infections Drive U.S. Airport Snarls"
2022-01-02,Want to Get Away From It All? Try This Luxury Ghost Town in Africa
2022-01-02,Can Paper Replace Plastic? A Packaging Giant Is Betting It Can
2022-01-02,Cash Floods Municipal-Bond Market
2022-01-02,Rising Threat From China Pushes U.S. and Japan to Deepen Military Cooperation
2022-01-02,Metaverse Needs More Than VR Christmas Bump
2022-01-02,Workers Should See Job Gains Even Amid the Latest Covid-19 Wave
2022-01-02,Real-Life Relationship Advice for Pandemic Times
2022-01-02,"Italy’s Embattled Berlusconi Eyes the Presidency, His Biggest Prize Yet"
2022-01-02,South Korea Says Individual Entered North Korea Through DMZ
2022-01-02,Democrats Seek Filibuster Changes to Pass Elections Bills
2022-01-02,Cheaper Stocks Boost S&P 500’s Prospects in New Year
2022-01-02,An All-SEC Final Is the Latest Obstacle to Expanding the College Football Playoff
2022-01-02,Chip Makers Contend for Scarce Talent
2022-01-02,Stocks Face Obstacles as Rate Increases Loom
2022-01-02,"The $2 Trillion Cryptocurrency Market Is Drawing Interest From Investors, Scrutiny From U.S. Regulators"
2022-01-02,A Grieving Family Wonders: What if They Had Known the Medical History of Sperm Donor 1558?
2022-01-02,Electric Motors Are About to Get a Major Upgrade Thanks to Benjamin Franklin
2022-01-02,How College Students Beat Boeing in a Battle to Take Down Drones
2022-01-02,A Tattooed Union Leader Is Threatening to Topple a GOP Senator in a Deep-Red State
2022-01-02,Does Everything in Your Blue Bin Really Get Recycled? You’d Be Surprised
2022-01-02,The Racial Identity of Americans Is Rapidly Blurring. Politics Hasn’t Caught Up.
2022-01-02,Israel Releases Video Said to Show Final Moments of Hamas Leader Sinwar03:25
2022-01-02,Israel Releases Video Said to Show Final Moments of Hamas Leader Sinwar
2022-01-02,WSJ Opinion: Trump Calls Out Harris for Skipping Al Smith Dinner03:36
2022-01-02,WSJ Opinion: Trump Calls Out Harris for Skipping Al Smith Dinner
2022-01-02,Watch: Trump’s Microphone Cuts Out Mid-Speech in Detroit01:38
2022-01-02,Watch: Trump’s Microphone Cuts Out Mid-Speech in Detroit
2022-01-02,"WSJ Poll Shows Tied Battle for Swing States, Trump Leads on Top Issues02:44"
2022-01-02,"WSJ Poll Shows Tied Battle for Swing States, Trump Leads on Top Issues"
2022-01-02,Netanyahu: ‘Hamas Will No Longer Rule Gaza’ After Yahya Sinwar’s Death02:16
2022-01-02,Netanyahu: ‘Hamas Will No Longer Rule Gaza’ After Yahya Sinwar’s Death
2022-01-02,Corporate Subscriptions
2022-01-02,WSJ Higher Education Program
2022-01-02,WSJ High School Program
2022-01-02,Public Library Program
2022-01-02,Commercial Partnerships
2022-01-02,Cancel My Subscription
2022-01-02,Commercial Real Estate Ads
2022-01-02,Place a Classified Ad
2022-01-02,Recruitment & Career Ads
2022-01-02,Dow Jones Smart Money
2022-01-03,Schumer’s Filibuster Stunt
2022-01-03,A European Revelation on Climate
2022-01-03,"The Great Pandemic Migration, II"
2022-01-03,Entitlements Always Grow and Grow
2022-01-03,Should a Stuffy Nose Stop a Nurse From Working?
2022-01-03,Covid Should Revive School Vouchers as a Liberal Cause
2022-01-03,Covid Isolation Sows a Gardening Boom
2022-01-03,"For Putin, OPEC and Trump, 2021 Was a Good Year"
2022-01-03,Biden’s Air-Traffic Controllers
2022-01-03,‘Get It Done’ Review: A Mindset for Motivation
2022-01-03,Andrew Cuomo Nursing-Home Probe Ends
2022-01-03,Crypto CEO Brian Armstrong Buys Los Angeles Home for $133 Million
2022-01-03,Tesla Stock Jumps to Start 2022
2022-01-03,What to Listen to in 2022: A Playlist for the Year Ahead
2022-01-03,Ghislaine Maxwell Trial Verdict: Guilty on Five of Six Criminal Counts in Her Sex-Trafficking Case
2022-01-03,Facebook Removes Marjorie Taylor Greene’s Post a Day After Twitter Suspension
2022-01-03,Omicron Surge Stymies Public-Transit Systems
2022-01-03,Alec Baldwin on Fatal ‘Rust’ Shooting: ‘No One Wants the Truth More Than I Do’
2022-01-03,Ghislaine Maxwell Trial: What to Know
2022-01-03,Covid-19 Cases Soar to New Records in U.S.
2022-01-03,When Can We Expect a Verdict in the Elizabeth Holmes Trial?
2022-01-03,Stocks Rise on First Trading Day of 2022
2022-01-03,Apple Briefly Tops $3 Trillion Market Cap
2022-01-03,‘Rigoletto’ Review: Deco Drama
2022-01-03,Schumer Sets Mid-January Deadline for Possible Filibuster Changes
2022-01-03,Airbnb Settles With U.S. on Alleged Violations of Cuba Sanctions
2022-01-03,"Let’s Hurry It Up Here! (Tuesday Crossword, January 4)"
2022-01-03,New Year Sends Treasury Yields Higher
2022-01-03,Jury in Elizabeth Holmes Trial Deadlocked on Three of 11 Counts
2022-01-03,Apple at $3 Trillion Isn’t All About Apple
2022-01-03,"Starbucks Imposes Vaccine, Testing Requirements for U.S. Workers"
2022-01-03,Athletes’ Olympian Task: Secure a Beijing Berth—and Don’t Get Omicron
2022-01-03,The Covid Clash Between Freedom and Duty
2022-01-03,Germany Follows California Into Energy Danger
2022-01-03,Israel Is Always on Trial at the U.N. Star Chamber
2022-01-03,Required Reading for ‘Defund the Police’ Advocates
2022-01-03,Truck Drivers Deliver Christmas
2022-01-03,FDA Authorizes Pfizer-BioNTech Booster for 12- to 15-Year-Olds
2022-01-03,Electric Motors Are About to Get a Major Upgrade Thanks to Benjamin Franklin
2022-01-03,How College Students Beat Boeing in a Battle to Take Down Drones
2022-01-03,A Tattooed Union Leader Is Threatening to Topple a GOP Senator in a Deep-Red State
2022-01-03,Does Everything in Your Blue Bin Really Get Recycled? You’d Be Surprised
2022-01-03,The Racial Identity of Americans Is Rapidly Blurring. Politics Hasn’t Caught Up.
2022-01-03,Israel Releases Video Said to Show Final Moments of Hamas Leader Sinwar03:25
2022-01-03,Israel Releases Video Said to Show Final Moments of Hamas Leader Sinwar
2022-01-03,WSJ Opinion: Trump Calls Out Harris for Skipping Al Smith Dinner03:36
2022-01-03,WSJ Opinion: Trump Calls Out Harris for Skipping Al Smith Dinner
2022-01-03,Watch: Trump’s Microphone Cuts Out Mid-Speech in Detroit01:38
2022-01-03,Watch: Trump’s Microphone Cuts Out Mid-Speech in Detroit
2022-01-03,"WSJ Poll Shows Tied Battle for Swing States, Trump Leads on Top Issues02:44"
2022-01-03,"WSJ Poll Shows Tied Battle for Swing States, Trump Leads on Top Issues"
2022-01-03,Netanyahu: ‘Hamas Will No Longer Rule Gaza’ After Yahya Sinwar’s Death02:16
2022-01-03,Netanyahu: ‘Hamas Will No Longer Rule Gaza’ After Yahya Sinwar’s Death
2022-01-03,Corporate Subscriptions
2022-01-03,WSJ Higher Education Program
2022-01-03,WSJ High School Program
2022-01-03,Public Library Program
2022-01-03,Commercial Partnerships
2022-01-03,Cancel My Subscription
2022-01-03,Commercial Real Estate Ads
2022-01-03,Place a Classified Ad
2022-01-03,Recruitment & Career Ads
2022-01-03,Dow Jones Smart Money
2022-01-04,Toyota Overtakes GM as Bestselling Auto Maker in U.S.
2022-01-04,New Jersey Says It Is Leaving Port-Crime Watchdog
2022-01-04,Overturning the Next Election
2022-01-04,Last of Stranded Drivers on I-95 in Virginia Freed After Winter Storm
2022-01-04,New York’s Trump Inquisition
2022-01-04,Should We Abandon or Embrace New Year’s Resolutions?
2022-01-04,Europe Energy Crisis Goes Global
2022-01-04,Joe Biden’s Inflationary Trade Policy
2022-01-04,I Got Covid on a Cruise. I’d Take Another
2022-01-04,Protests Don’t Belong at Their Targets’ Homes
2022-01-04,Eric Adams Should Remember David Dinkins’s Legacy
2022-01-04,‘In Pursuit of the Perfect Portfolio’ Review: Models and Mavens
2022-01-04,TPG Launches IPO Roadshow Seeking Valuation Around $9.5 Billion
2022-01-04,What Ever Happened to ‘Patient First’?
2022-01-04,"Heroes, Villains and the Study of International Relations"
2022-01-04,"Southwest, JetBlue and Other Airlines Cancel Over 1,000 U.S. Flights"
2022-01-04,The Intelligent Investor Considers Opportunity Cost
2022-01-04,Socialism Requires a Lot of Forgetting
2022-01-04,"Noonan, Masks and the Movie Theater"
2022-01-04,"In Los Angeles, ‘Fast & Furious’ Director Lists Penthouse for $7 Million"
2022-01-04,Build Back Better Takes Back Seat to Democrats’ Election-Law Push
2022-01-04,U.S. Prevails Over Canada in Dairy Dispute Under New Trade Deal
2022-01-04,Disapproval of Biden Hits New High
2022-01-04,Nirvana Album Cover Lawsuit Is Dismissed
2022-01-04,Underused Office Buildings Get New Life as Deluxe Apartments
2022-01-04,Oil Jumps as OPEC Sees Limited Omicron Impact
2022-01-04,"Dow Industrials Notch Record, Tech Stocks Fall"
2022-01-04,Canada Reaches $15 Billion Settlement With Indigenous Peoples
2022-01-04,Washington Football Team to Announce New Name Next Month
2022-01-04,‘Good Sam’ Review: Feuding Family Practice
2022-01-04,"‘Good Time Music: (Community Music, Vol. 2)’ by Steven Bernstein Review: Many Shades of Blues"
2022-01-04,‘The Tender Bar’ Review: Writing Under the Influence
2022-01-04,The New Way to Maximize Your Workout? Weighted Spandex
2022-01-04,Ford Doubles Production Goal for F-150 Electric Pickup
2022-01-04,Venezuela’s U.S.-Backed Opposition Frays as Maduro Tightens Grip
2022-01-04,"Acing It (Wednesday Crossword, January 5)"
2022-01-04,"In Elizabeth Holmes Trial, U.S. Gave Patients a Small Stage"
2022-01-04,Europe Struggles to Meet China’s Trade Challenge
2022-01-04,Electric Motors Are About to Get a Major Upgrade Thanks to Benjamin Franklin
2022-01-04,How College Students Beat Boeing in a Battle to Take Down Drones
2022-01-04,A Tattooed Union Leader Is Threatening to Topple a GOP Senator in a Deep-Red State
2022-01-04,Does Everything in Your Blue Bin Really Get Recycled? You’d Be Surprised
2022-01-04,The Racial Identity of Americans Is Rapidly Blurring. Politics Hasn’t Caught Up.
2022-01-04,Israel Releases Video Said to Show Final Moments of Hamas Leader Sinwar03:25
2022-01-04,Israel Releases Video Said to Show Final Moments of Hamas Leader Sinwar
2022-01-04,WSJ Opinion: Trump Calls Out Harris for Skipping Al Smith Dinner03:36
2022-01-04,WSJ Opinion: Trump Calls Out Harris for Skipping Al Smith Dinner
2022-01-04,Watch: Trump’s Microphone Cuts Out Mid-Speech in Detroit01:38
2022-01-04,Watch: Trump’s Microphone Cuts Out Mid-Speech in Detroit
2022-01-04,"WSJ Poll Shows Tied Battle for Swing States, Trump Leads on Top Issues02:44"
2022-01-04,"WSJ Poll Shows Tied Battle for Swing States, Trump Leads on Top Issues"
2022-01-04,Netanyahu: ‘Hamas Will No Longer Rule Gaza’ After Yahya Sinwar’s Death02:16
2022-01-04,Netanyahu: ‘Hamas Will No Longer Rule Gaza’ After Yahya Sinwar’s Death
2022-01-04,Corporate Subscriptions
2022-01-04,WSJ Higher Education Program
2022-01-04,WSJ High School Program
2022-01-04,Public Library Program
2022-01-04,Commercial Partnerships
2022-01-04,Cancel My Subscription
2022-01-04,Commercial Real Estate Ads
2022-01-04,Place a Classified Ad
2022-01-04,Recruitment & Career Ads
2022-01-04,Dow Jones Smart Money
2022-01-05,Biden’s Immigration Self-Sabotage
2022-01-05,Ghislaine Maxwell Lawyers Request New Trial After Juror Interviews
2022-01-05,Omicron Pushes Wall Street Toward Work-From-Home Future
2022-01-05,Congress Ducks Blame for the Capitol Riot
2022-01-05,Inflation and the ‘Experience Economy’
2022-01-05,Republicans’ Jan. 6 Responsibility
2022-01-05,Today’s Soaring Energy Prices Are Only the Beginning
2022-01-05,Stop Calling Jan. 6 an ‘Insurrection’
2022-01-05,Manchin-Adams in 2024?
2022-01-05,‘Aquanaut’ Review: Depth-Defying Rescue
2022-01-05,"Airlines Scrap Over 1,000 Flights for 11th Straight Day"
2022-01-05,Hasbro Taps Wizards of the Coast Division Chief Chris Cocks as CEO
2022-01-05,Garland Says Jan. 6 Instigators Could Face Prosecution Along With Rioters
2022-01-05,AT&T Shed Media Assets in 2021. Now It Wants Investors.
2022-01-05,Fed Minutes Point to Possible Rate Increase in March
2022-01-05,Biden Steps Up Vaccine Push as U.S. Cases Surge
2022-01-05,Interest-Rate Worries Batter Stock Market
2022-01-05,Military Bases Housing U.S. Forces Attacked in Syria and Iraq
2022-01-05,Grammy Awards Postponed Due to Omicron
2022-01-05,Auto Makers Supercharge Move Into Electric Vehicles
2022-01-05,"Salesforce.com Shares, Software Companies Stumble to Start Year"
2022-01-05,The Fed Hasn’t Caught Omicron Yet
2022-01-05,Discovering Roberto Gavaldón’s Cinematic Brilliance
2022-01-05,‘Aerial Vision’ Review: Flights of Fancy
2022-01-05,Omicron School Disruptions Stress Already-Frayed Parents—Again
2022-01-05,"Markets Jingle, but Not All the Way, to a Santa Rally"
2022-01-05,Looking to Eat Less Meat? This Winter Salad Recipe Makes a Hearty Meal
2022-01-05,"American Households Face Their Worst Fear: ‘Ew, What’s That Smell?’"
2022-01-05,Tony Blair’s Knighthood Sparks Protest Petition Over Iraq War
2022-01-05,"Downpours (Thursday Crossword, January 6)"
2022-01-05,"For Logistics Events, the Show Must Go On"
2022-01-05,Warner Boss Doesn’t See Omicron Slowing Down Production of Shows
2022-01-05,Are Chicago Students Suffering With or From Teachers Unions?
2022-01-05,What to Watch: Around the World in Five Streaming Titles
2022-01-05,Blinder Can’t Explain Away the Inflation Fiasco
2022-01-05,Covid Booster Shots Are Safe for Teenagers
2022-01-05,Striking Graduate Students Are Not ‘Workers’
2022-01-05,Biden Vets the Bureaucracy
2022-01-05,"Media Conformity Is Shaken, Not Stirred"
2022-01-05,Electric Motors Are About to Get a Major Upgrade Thanks to Benjamin Franklin
2022-01-05,How College Students Beat Boeing in a Battle to Take Down Drones
2022-01-05,A Tattooed Union Leader Is Threatening to Topple a GOP Senator in a Deep-Red State
2022-01-05,Does Everything in Your Blue Bin Really Get Recycled? You’d Be Surprised
2022-01-05,The Racial Identity of Americans Is Rapidly Blurring. Politics Hasn’t Caught Up.
2022-01-05,Israel Releases Video Said to Show Final Moments of Hamas Leader Sinwar03:25
2022-01-05,Israel Releases Video Said to Show Final Moments of Hamas Leader Sinwar
2022-01-05,WSJ Opinion: Trump Calls Out Harris for Skipping Al Smith Dinner03:36
2022-01-05,WSJ Opinion: Trump Calls Out Harris for Skipping Al Smith Dinner
2022-01-05,Watch: Trump’s Microphone Cuts Out Mid-Speech in Detroit01:38
2022-01-05,Watch: Trump’s Microphone Cuts Out Mid-Speech in Detroit
2022-01-05,"WSJ Poll Shows Tied Battle for Swing States, Trump Leads on Top Issues02:44"
2022-01-05,"WSJ Poll Shows Tied Battle for Swing States, Trump Leads on Top Issues"
2022-01-05,Netanyahu: ‘Hamas Will No Longer Rule Gaza’ After Yahya Sinwar’s Death02:16
2022-01-05,Netanyahu: ‘Hamas Will No Longer Rule Gaza’ After Yahya Sinwar’s Death
2022-01-05,Corporate Subscriptions
2022-01-05,WSJ Higher Education Program
2022-01-05,WSJ High School Program
2022-01-05,Public Library Program
2022-01-05,Commercial Partnerships
2022-01-05,Cancel My Subscription
2022-01-05,Commercial Real Estate Ads
2022-01-05,Place a Classified Ad
2022-01-05,Recruitment & Career Ads
2022-01-05,Dow Jones Smart Money
